Poste de depense,Categorie,Cout Unitaire (EUR),Quantite,Total (EUR),Type,Note
Licences OpenAI API (GPT-4o),Tech/IA,150,4,600,Mensuel,Moteur conversationnel vocal
Abonnement Lemlist + Scraping,Sales,120,1,120,Mensuel,Prospection B2B massive
Design & Storytelling Assets,Marketing,450,1,450,Fixe,Creation charte et video demo
Infrastructure Cloud (AWS/Vercel),Tech,80,1,80,Mensuel,Hebergement plateforme WebXR
Maintenance & Onboarding,CSM,300,1,300,Mensuel,Support technique et formation
**TOTAL INVESTISSEMENT PILOTE**,TOTAL,-,-,1550,-,Budget de lancement logiciel seul
**REVENU VISÉ (3 LOI x 15k€)**,REVENUE,15000,3,45000,-,Objectif CA J+30
**ROI PROJETÉ**,PERCENT,-,-,2803,-,Rentabilité exceptionnelle (Sans hardware)
